"project_id","is_geocoded","project_title","start_actual_isodate","start_actual_type","end_actual_isodate","end_actual_type","donors","donors_iso3","recipients","recipients_iso3","ad_sector_codes","ad_sector_names","status","transactions_start_year","transactions_end_year","total_commitments","total_disbursements"
"87292401925","1","Preparatory Survey for The Project for Rehabilitation of Buluto irrigation Scheme","","start-actual","","end-actual","Japan International Cooperation Agency","JPN","Timor-Leste","TLS","311","Agriculture","Implementation","2012","2014","802016.445004","602608.04034"
"87292404407","1","Agriculture Sector Management Advisor","2013-07-29","start-actual","2015-02-28","end-actual","Japan International Cooperation Agency","JPN","Timor-Leste","TLS","311","Agriculture","Implementation","2013","2015","153614.76241","98441.2303582"
"87292991762","1","TLS-M-MOH - Expanding an integrated and comprehensive approach to malaria control in the Democratic Republic of Timor Leste","2012-01-01","start-actual","2014-12-31","end-actual","The Global Fund to Fight AIDS, Tuberculosis and Malaria","DAC","Timor-Leste","TLS","120","Health","Implementation","2012","2014","11520801.0022","8237153.29725"
"87292471702","1","R4D - Roads for Development","2012-03-01","start-actual","2016-02-29","end-actual","Australian Aid Program|DFAT - Australian Aid Program","AUS","Timor-Leste","TLS","210","Transport and storage","Implementation","2012","2016","22268718.2503","15313970.05"
"87292471699","1","ERA - Enhancing Rural Access","2011-09-02","start-actual","","end-actual","European Union","DAC","Timor-Leste","TLS","210","Transport and storage","Implementation","2011","2014","5970252.32928","6633519.47321"
"87292471522","1","BOSS - Business Opportunities and Support Services Project","2010-09-30","start-actual","","end-actual","Irish Aid|New Zealand Aid Programme, Ministry of Foreign Affairs and Trade","IRL|NZL","Timor-Leste","TLS","250","Business and other services","Implementation","2010","2014","6867345.89427","5916289.60061"
"87292457151","0","Bolsas de Estudo (3236)","2001-01-01","start-actual","2016-12-31","end-actual","Unspecified","DAC","Timor-Leste","TLS","110","Education","Implementation","2001","2016","",""
"87292455365","1","Bolsas de Estudo - Língua Portuguesa (3236)","2001-01-01","start-actual","2016-12-31","end-actual","Camões - Instituto Da Cooperacao E Da Lingua","POR","Timor-Leste","TLS","110","Education","Implementation","2001","2016","42375.0","16081.0310486"
"87292455899","1","Assessoria ao Gabinete do Presidente da República (7620)","2007-01-01","start-actual","2012-12-31","end-actual","Camões - Instituto Da Cooperacao E Da Lingua","POR","Timor-Leste","TLS","150","Government and civil society","Completion","2007","2012","134384.47","131479.61"
"87292455823","1","Fortalecimento do Sistema Judiciário - Projeto Global (8365)","2008-01-01","start-actual","","end-actual","Camões - Instituto Da Cooperacao E Da Lingua|Portugal","PRT|POR","Timor-Leste","TLS","150","Government and civil society","Implementation","2008","2013","3041319.39347","2771852.84506"
"87292452222","1","Apoio à Comunicação Social (9632)","2011-01-01","start-actual","","end-actual","Camões - Instituto Da Cooperacao E Da Lingua","POR","Timor-Leste","TLS","220","Communications","Implementation","2011","2013","3095928.75915","1097400.44632"
"87292457144","0","Envelope Financeiro - Setor do Desenvolvimento Integrado (10436)","2015-01-01","start-actual","","end-actual","Camões - Instituto Da Cooperacao E Da Lingua","POR","Timor-Leste","TLS","998","Unallocated/unspecified","Pipeline/identification","2015","2015","",""
"87292457140","0","Envelope Financeiro - Reforço Institucional (10434)","2015-01-01","start-actual","2017-12-31","end-actual","Camões - Instituto Da Cooperacao E Da Lingua","POR","Timor-Leste","TLS","998","Unallocated/unspecified","Implementation","2015","2017","",""
"87292455368","1","Cooperação do Laboratório Nacional de Engenharia Civil (9583)","2011-01-01","start-actual","","end-actual","Camões - Instituto Da Cooperacao E Da Lingua|Portugal","PRT|POR","Timor-Leste","TLS","400","Multisector/cross-cutting","Implementation","2011","2013","307155.886024","58403.5917856"
"87292452091","1","Projeto de Formação Inicial e Contínua de Professores (9453)","2012-01-01","start-actual","","end-actual","Camões - Instituto Da Cooperacao E Da Lingua|Portugal","PRT|POR","Timor-Leste","TLS","110","Education","Implementation","2012","2013","7415853.63252","5840362.80076"
"87292455825","1","Comunidade Saudável (8631)","2009-01-01","start-actual","","end-actual","Camões - Instituto Da Cooperacao E Da Lingua","POR","Timor-Leste","TLS","130","Population policies/programmes and reproductive health","Implementation","2009","2013","278509.134718","195736.664764"
"87292455924","1","Custos Administrativos - Encargos com Conselheiros e Adidos para a Cooperação nas Embaixadas (8418)","2008-01-01","start-actual","","end-actual","Portugal","PRT","Timor-Leste","TLS","910","Administrative costs of donors","Implementation","2008","2013","658773.295132","642627.9181"
"87292452230","1","Programa Mós Bele - Cluster da Cooperação Portuguesa em Timor-Leste (7821)","2008-01-01","start-actual","","end-actual","Camões - Instituto Da Cooperacao E Da Lingua","POR","Timor-Leste","TLS","400","Multisector/cross-cutting","Implementation","2008","2016","1818700.62234","1539087.05514"
"87292452233","1","Mais Cidadania, Mais Desenvolvimento (9519)","2011-01-01","start-actual","","end-actual","Camões - Instituto Da Cooperacao E Da Lingua","POR","Timor-Leste","TLS","150","Government and civil society","Implementation","2011","2014","127286.02","99394.17"
"87292455829","1","Bolsas de estudo - Projeto global (9451)","2012-01-01","start-actual","","end-actual","Camões - Instituto Da Cooperacao E Da Lingua","POR","Timor-Leste","TLS","110","Education","Implementation","2012","2012","",""
"87292495980","1","Terasanta Youth Community Center; Dreams for children, Hopes for youth, Peace for community!","","start-actual","","end-actual","Korean International Cooperation Agency","KOR","Timor-Leste","TLS","110|160","Education|Other social infrastructure and services","Completion","2008","2008","","50628.1124936"
"87292495985","1","“East Timor Coffee Fair Trade Campaign”: Technical development of agriculture and improving capacity of process","","start-actual","","end-actual","Korean International Cooperation Agency","KOR","Timor-Leste","TLS","311","Agriculture","Completion","2009","2009","","73666.2538882"
"87292456388","0","Projeto de Cooperação em Matéria de Propriedade Industrial (10472)","2013-03-12","start-actual","2013-12-31","end-actual","Portugal","PRT","Timor-Leste","TLS","321","Industry","Implementation","2013","2013","3167.56457178","3167.56457178"
"87292495979","1","“East Timor Coffee Fair Trade Campaign”: Improving Green-beans' Quality and Agricultural Productive Capacity by Introducing New Coffee Bean Processing Method","","start-actual","","end-actual","Korean International Cooperation Agency","KOR","Timor-Leste","TLS","311","Agriculture","Completion","2008","2008","","49573.3527551"
"87292456387","0","Fortalecimento do combate ao HIV/SIDA em Timor-Leste (10393)","2013-12-17","start-actual","2013-12-31","end-actual","Portugal","PRT","Timor-Leste","TLS","130","Population policies/programmes and reproductive health","Implementation","2013","2013","71068.7898307","71068.7898307"
"87292497114","0","Community-based sustainable solar system project (3rd year / support renewable based on the result of evaluation)","","start-actual","","end-actual","Korean International Cooperation Agency","KOR","Timor-Leste","TLS","230","Energy generation and supply","Implementation","2013","2013","","194707.553996"
"87292381485","1","Strengthening Parliamentary Democracy in Timor-Leste(00073810)","2010-01-01","start-actual","","end-actual","Swedish International Development Cooperation Agency|United Nations Development Programme|DFAT - Australian Aid Program|Australian Aid Program|Italian Ministry of Foreign Affairs|Norway|United Nations","AUS|DAC|SWE|NOR|ITA","Timor-Leste","TLS","150","Government and civil society","Implementation","2010","2014","4903568.99553","5031894.96749"
"87292381468","1","Local Governance Support Programme (00053898)","2007-01-01","start-actual","","end-actual","United Nations Capital Development Fund|Norway|Government Of Ireland|United Nations Development Programme","IRL|NOR|DAC","Timor-Leste","TLS","150","Government and civil society","Implementation","2007","2014","3018908.7215","5393900.60052"
"87292495977","1","Project of hygiene education and water quality improvement for residents in Timor Leste","2008-05-01","start-actual","2008-11-30","end-actual","Korean International Cooperation Agency","KOR","Timor-Leste","TLS","140","Water supply and sanitation","Completion","2008","2008","","52737.6110909"
"87292455801","1","ForSa - Formação em Saúde em Timor-Leste (10060)","2013-01-01","start-actual","","end-actual","Camões - Instituto Da Cooperacao E Da Lingua","POR","Timor-Leste","TLS","120","Health","Implementation","2013","2017","494672.6","47021.8738925"
"87292495939","1","Establishment of the Timor-Leste Public Postal Service","2009-07-01","start-actual","2010-04-30","end-actual","Korean International Cooperation Agency","KOR","Timor-Leste","TLS","210|160","Transport and storage|Other social infrastructure and services","Completion","2008","2010","","2321160.93248"
"87292455804","1","Assistência técnica e reforço das competências da HASATIL e das Organizações da Sociedade Civil de Desenvolvimento Rural em Timor Leste (10048)","2012-06-03","start-actual","","end-actual","Camões - Instituto Da Cooperacao E Da Lingua","POR","Timor-Leste","TLS","400","Multisector/cross-cutting","Implementation","2012","2015","415149.67","259265.316327"
"87292491506","1","Geological Mapping of Suai district","2010-01-01","start-actual","","end-actual","Korean International Cooperation Agency","KOR","Timor-Leste","TLS","322","Mineral resources and mining","Completion","2010","2012","1736239.89288","2005383.2053"
"87292455341","1","Centro Cultural Português de Díli (9932)","2001-01-01","start-actual","","end-actual","Camões - Instituto Da Cooperacao E Da Lingua","POR","Timor-Leste","TLS","160","Other social infrastructure and services","Implementation","2001","2017","629948.19","329415.557266"
"87292381464","1","Strengthening the Justice System Programme in Timor Leste(00014955)","2008-12-01","start-actual","","end-actual","Government Of Australia|Ministry of Foreign Affairs and Cooperation|Embassy of Netherlands|DFAT - Australian Aid Program|Norway|Belgian Technical Cooperation|Australian Aid Program|Office of the United Nations High Commissioner for|Government Of Ireland","BEL|DAC|AUS|IRL|NLD|NOR","Timor-Leste","TLS","150","Government and civil society","Implementation","2007","2014","33060641.0007","34214353.8223"
"87292495935","1","Strengthening Health Care Service Capacity of Dili National Hospital in Timor-Leste","","start-actual","","end-actual","Korean International Cooperation Agency","KOR","Timor-Leste","TLS","120","Health","Completion","2008","2008","","688165.250592"
"87292495938","1","Establishment of an Emergency Medical Service System for Timor-Leste","","start-actual","","end-actual","Korean International Cooperation Agency","KOR","Timor-Leste","TLS","120","Health","Completion","2007","2008","","841242.671291"
"87292491505","1","Developing and publishing Tetum textbooks and teacher's guides for basic and secondary schools","2010-10-01","start-actual","","end-actual","Korean International Cooperation Agency","KOR","Timor-Leste","TLS","110","Education","Implementation","2010","2012","5055522.04102","9667555.16584"
"87292387080","0","Consolidating the Democratic Rule of Law and Peace through a strong Justice System in Timor-Leste (Revised Justice System Programme)-(00088880)","","start-actual","","end-actual","Australian Aid Program|Government Of Japan|United Nations Development Programme|Portugal|DFAT - Australian Aid Program","PRT|AUS|DAC|JPN","Timor-Leste","TLS","150","Government and civil society","Implementation","2014","2014","","46904.0"
"87292455369","1","Rede de Docência de Língua Portuguesa","2001-01-01","start-actual","2017-12-31","end-actual","Camões - Instituto Da Cooperacao E Da Lingua","POR","Timor-Leste","TLS","110","Education","Implementation","2001","2017","446296.070011","313507.719264"
"87292455976","1","Programa de Cooperação Técnico-Policial - Programa Global (9688)","2011-01-01","start-actual","2013-12-31","end-actual","Portugal","PRT","Timor-Leste","TLS","150","Government and civil society","Completion","2011","2013","1085438.69751","1023503.13704"
"87292497090","0","Corn Breeding and rural income generation project (3rd year / support renewable based on the result of evaluation)","","start-actual","","end-actual","Korean International Cooperation Agency","KOR","Timor-Leste","TLS","311","Agriculture","Implementation","2011","2011","","57486.8"
"87292387074","0","National Human Development Report - NHDR4(00089454)","","start-actual","","end-actual","United Nations Development Programme","DAC","Timor-Leste","TLS","400","Multisector/cross-cutting","Implementation","2014","2014","","5035.0"
"87292497087","0","Corn Breeding and rural income generation project","","start-actual","","end-actual","Korean International Cooperation Agency","KOR","Timor-Leste","TLS","311","Agriculture","Implementation","2009","2009","","20912.7664452"
"87292455942","1","Bolsas de Estudo de Ensino Público - Mestrado (9685)","2012-01-01","start-actual","2013-12-31","end-actual","Camões - Instituto Da Cooperacao E Da Lingua","POR","Timor-Leste","TLS","110","Education","Completion","2012","2013","139206.255855","101711.765102"
"87292455943","1","Bolsas de Estudo de Ensino Público - Doutoramento (9686)","2012-01-01","start-actual","2013-12-31","end-actual","Camões - Instituto Da Cooperacao E Da Lingua","POR","Timor-Leste","TLS","110","Education","Completion","2012","2013","94087.9968545","79788.9158887"
"87292497076","0","Water Supply Project for Acumano Village(2nd year / support renewable based on the result of evaluation)","","start-actual","","end-actual","Korean International Cooperation Agency","KOR","Timor-Leste","TLS","140","Water supply and sanitation","Implementation","2013","2013","","49017.5150787"
"87292381484","1","Strengthening Institutional Capacity of the National Parliament in Timor-Leste (00079669)","2011-08-01","start-actual","","end-actual","European Union","DAC","Timor-Leste","TLS","150","Government and civil society","Implementation","2011","2014","5500000.0","3050048.13565"
"87292452214","1","Projeto de Apoio à Capacitação da Universidade Nacional de Timor Lorosa'e (9669)","2012-06-26","start-actual","","end-actual","Camões - Instituto Da Cooperacao E Da Lingua","POR","Timor-Leste","TLS","110","Education","Implementation","2012","2016","1413001.12013","80528.7024247"
"87292381483","1","Capacity Development for the Provedoria for Human Rights and Justice(PDHJ)00073841","2010-01-01","start-actual","","end-actual","Swedish International Development Cooperation Agency|United Nations Development Programme|Irish Aid|United Nations Office for the Coordination of Humanitarian Affairs|Government Of Ireland|New Zealand Aid Programme, Ministry of Foreign Affairs and Trade","SWE|DAC|IRL|NZL","Timor-Leste","TLS","150","Government and civil society","Implementation","2010","2014","2333023.33281","2886956.71732"
"87292455835","0","Programa de Desenvolvimento Rural - Cooperação Delegada (9667)","2012-01-01","start-actual","","end-actual","Camões - Instituto Da Cooperacao E Da Lingua|European Union","POR|DAC","Timor-Leste","TLS","311","Agriculture","Implementation","2012","2013","1122403.21606","2509187.63446"
"87292455832","1","Programa de Comunicação Social - Cooperação Delegada (9666)","2012-01-01","start-actual","","end-actual","Camões - Instituto Da Cooperacao E Da Lingua|European Union","POR|DAC","Timor-Leste","TLS","220","Communications","Implementation","2012","2013","783214.28507","811648.6718"
"87292455831","1","Programa de Justiça - Cooperação Delegada (9665)","2012-01-01","start-actual","","end-actual","Camões - Instituto Da Cooperacao E Da Lingua|European Union","POR|DAC","Timor-Leste","TLS","150","Government and civil society","Implementation","2012","2013","4508570.47236","2556563.88182"
"87292495989","1","Water Supply Project for Acumano Village, Timor-Leste","","start-actual","2012-12-31","end-actual","Korean International Cooperation Agency","KOR","Timor-Leste","TLS","140","Water supply and sanitation","Completion","2012","2012","","84999.9091304"
"87292497058","0","Lospalos rural development project (4th year / support renewable based on the result of evaluation))","","start-actual","","end-actual","Korean International Cooperation Agency","KOR","Timor-Leste","TLS","920","Support to non-governmental organisations (NGOs) and government organizations","Implementation","2013","2013","","124308.39188"
"87292497056","0","Lospalos rural development project","","start-actual","","end-actual","Korean International Cooperation Agency","KOR","Timor-Leste","TLS","920","Support to non-governmental organisations (NGOs) and government organizations","Implementation","2008","2008","","69613.6520687"
"87292455941","1","Bolsas de Formação Avançada de Licenciados (9487)","2011-07-01","start-actual","2013-12-31","end-actual","Portugal","PRT","Timor-Leste","TLS","110","Education","Completion","2011","2013","37534.218139","35955.8326055"
"87292455932","1","Provisão para encargos não previstos - SEPFOPE (9443)","2011-01-01","start-actual","2013-12-31","end-actual","Portugal","PRT","Timor-Leste","TLS","160","Other social infrastructure and services","Completion","2011","2013","",""
"87292456419","0","Cooperação Estatística - Projeto Global (9225)","2010-01-01","start-actual","2013-12-31","end-actual","Portugal","PRT","Timor-Leste","TLS","160","Other social infrastructure and services","Implementation","2010","2013","1379.31182652","1380.73724763"
"87292455931","1","Protocolo de Cooperação - Município de Tavira e Fundação de São José / Diocese de Baucau (9107)","2010-01-01","start-actual","2013-12-31","end-actual","Portugal","PRT","Timor-Leste","TLS","110","Education","Implementation","2010","2013","103875.600154","10485.44"
"87292455455","1","Apoio à Formação de Cursos de Oficiais e Sargentos das FDTL (7821)","2006-01-01","start-actual","2012-12-31","end-actual","Portugal","PRT","Timor-Leste","TLS","150","Government and civil society","Implementation","2006","2013","212132.769175","390230.999772"
"87292455454","1","Apoio à Componente Terrestre (7820)","2006-01-01","start-actual","2012-12-31","end-actual","Portugal","PRT","Timor-Leste","TLS","150","Government and civil society","Implementation","2006","2013","1420818.1294","1643835.30336"
"87292455921","1","Despesas de Estrutura (7818)","2006-01-01","start-actual","2012-12-31","end-actual","Portugal","PRT","Timor-Leste","TLS","910","Administrative costs of donors","Implementation","2006","2013","1179068.25564","876673.35565"
"87292455795","1","Hospitalizações - Assistência sanitária em Portugal (7816)","2009-01-01","start-actual","2013-12-31","end-actual","Portugal","PRT","Timor-Leste","TLS","120","Health","Completion","2009","2013","8644.63958091","8424.78764111"
"87292455917","1","United Nations Integrated Mission in Timor-Leste (7793)","2006-01-01","start-actual","2013-12-31","end-actual","Portugal","PRT","Timor-Leste","TLS","150","Government and civil society","Completion","2006","2013","25263243.6031","16057965.3825"
"87292455456","1","Bolsas de Ensino Militar - Formação Extraordinária (7758)","2006-01-01","start-actual","2012-12-31","end-actual","Camões - Instituto Da Cooperacao E Da Lingua","POR","Timor-Leste","TLS","150","Government and civil society","Completion","2006","2013","57976.9347109","53581.3096203"
"87292455821","1","Apoio ao Secretariado Técnico de Administração Eleitoral (7627)","2006-01-01","start-actual","2013-12-31","end-actual","Camões - Instituto Da Cooperacao E Da Lingua","POR","Timor-Leste","TLS","150","Government and civil society","Implementation","2006","2014","467516.78","248068.759434"
"87292455819","1","Assessoria ao Ministério dos Negócios Estrangeiros (7625)","2009-01-01","start-actual","2014-12-31","end-actual","Camões - Instituto Da Cooperacao E Da Lingua","POR","Timor-Leste","TLS","150","Government and civil society","Implementation","2009","2016","243991.07","81235.30535"
"87292455453","1","Apoio à Componente Naval (7402)","2005-01-01","start-actual","2012-12-31","end-actual","Portugal","PRT","Timor-Leste","TLS","150","Government and civil society","Implementation","2005","2013","1810049.76551","1873646.02559"
"87292455816","1","Provisão para encargos não previstos - Ministério da Solidariedade Social (6824)","2007-01-01","start-actual","2013-12-31","end-actual","Portugal","PRT","Timor-Leste","TLS","160","Other social infrastructure and services","Completion","2007","2013","627697.194271",""
"87292452221","1","Protocolos e Programas de Cooperação com Parlamentos homólogos e atividades desenvolvidas pelos Grupos Parlamentares de Amizade (6386)","2004-01-01","start-actual","2013-12-31","end-actual","Portugal","PRT","Timor-Leste","TLS","150","Government and civil society","Implementation","2004","2013","413509.45083","416902.920546"
"87292455797","1","Clínica de Motael em Díli (6173)","2005-01-01","start-actual","2013-12-31","end-actual","Camões - Instituto Da Cooperacao E Da Lingua|Portugal","PRT|POR","Timor-Leste","TLS","120","Health","Implementation","2005","2013","539958.436521","498256.0219"
"87292827030","0","Awareness Raising and Capacity Development to Reduce Post-harvest Losses in Horticultural Chains in Timor Leste","","start-actual","","end-actual","Food and Agriculture Organization","DAC","Timor-Leste","TLS","311","Agriculture","Implementation","2014","2014","251000.0",""
"87292455366","1","Ensino Superior em Portugal (6148)","2003-01-01","start-actual","","end-actual","Portugal","PRT","Timor-Leste","TLS","110","Education","Implementation","2003","2013","3900998.07985","3993580.42621"
"87292455812","1","Apoio aos serviços do Ministério da Solidariedade Social - Reforço Institucional (5592)","2002-01-01","start-actual","2013-12-31","end-actual","Portugal","PRT","Timor-Leste","TLS","160","Other social infrastructure and services","Completion","2002","2013","77924.1051106","5991.72660803"
"87292452211","1","Escola Portuguesa Ruy Cinatti – Centro de Ensino e Língua Portuguesa (5530)","2002-01-01","start-actual","","end-actual","Portugal","PRT","Timor-Leste","TLS","110","Education","Implementation","2002","2013","15573123.3133","15592735.9655"
"87292452231","1","Programa de Extensão Rural (4750)","2002-03-01","start-actual","2014-12-31","end-actual","Camões - Instituto Da Cooperacao E Da Lingua","POR","Timor-Leste","TLS","311","Agriculture","Implementation","2002","2014","975033.058439","797742.861245"
"87292455796","1","Cooperação ANACOM-ARCOM (4128)","2000-01-01","start-actual","2013-12-31","end-actual","Portugal","PRT","Timor-Leste","TLS","220","Communications","Implementation","2000","2013","12332.7916469","18662.8602173"
"87292455794","1","Custos Administrativos - Embaixada (4064)","2001-01-01","start-actual","","end-actual","Camões - Instituto Da Cooperacao E Da Lingua","POR","Timor-Leste","TLS","910","Administrative costs of donors","Implementation","2001","2016","1872351.28","1082944.52311"
"87292455452","1","Estrutura Superior da Defesa e das F-FDTL (4051)","2001-01-01","start-actual","2012-12-31","end-actual","Portugal","PRT","Timor-Leste","TLS","150","Government and civil society","Implementation","2001","2013","809235.335892","883210.027173"
"87292431579","1","Establishing a sustainable National Information and Early Warning System (NIEWS) on Food Secutiry in Timor-Leste","2011-12-23","start-actual","","end-actual","Food and Agriculture Organization|European Union","DAC","Timor-Leste","TLS","311","Agriculture","Implementation","2011","2014","1967477.44738","926181.764903"
"87292381532","1","Strengthening Resilience Small Infrastructure (00080317)","","start-actual","","end-actual","Global Environment Facility Trust Fund|United Nations Development Programme","DAC","Timor-Leste","TLS","140","Water supply and sanitation","Implementation","2012","2013","443010.439502","364123.058202"
"87292455339","1","A educação começa pelos mais pequenos (9075)","2010-03-09","start-actual","2013-12-31","end-actual","Camões - Instituto Da Cooperacao E Da Lingua","POR","Timor-Leste","TLS","110","Education","Implementation","2010","2013","37422.2825297","34537.8696275"
"87292455828","1","Ahimatan ba futuru (9072)","2010-03-09","start-actual","","end-actual","Camões - Instituto Da Cooperacao E Da Lingua","POR","Timor-Leste","TLS","400","Multisector/cross-cutting","Implementation","2010","2014","139986.169169","119242.33106"
"87292827005","0","National Food Security Policy Review","","start-actual","","end-actual","Food and Agriculture Organization","DAC","Timor-Leste","TLS","311","Agriculture","Implementation","2013","2014","79915.0","68389.9630954"
"87292455929","1","Luta Contra a Pobreza (8948)","2010-01-01","start-actual","2013-12-31","end-actual","Portugal","PRT","Timor-Leste","TLS","160","Other social infrastructure and services","Completion","2010","2013","2319598.03427","2216860.86718"
