"project_id","is_geocoded","project_title","start_actual_isodate","start_actual_type","end_actual_isodate","end_actual_type","donors","donors_iso3","recipients","recipients_iso3","ad_sector_codes","ad_sector_names","status","transactions_start_year","transactions_end_year","total_commitments","total_disbursements"
"87292643982","1","Managing Agro-Biodiversity for Sustainable Livelihoods in Timor-Leste (BMZ funds)","2012-03-08","start-actual","2016-01-31","end-actual","German Cooperation","DEU","Timor-Leste","TLS","311","Agriculture","Implementation","2012","2016","3227201.27717","1576894.55041"
"87292643967","1","Fourth Rural Development Programme IV (BMZ funds)","2012-03-08","start-actual","2016-01-31","end-actual","German Cooperation","DEU","Timor-Leste","TLS","311","Agriculture","Implementation","2012","2016","968160.379223","323863.922503"
"87292643957","0","Employment Promotion for Young People (YEP).","2008-01-09","start-actual","2013-06-30","end-actual","German Cooperation","DEU","Timor-Leste","TLS","311","Agriculture","Completion","2008","2014","5930389.70957","5755129.10773"
"87292645396","1","Advisory and Training for the Maritime Related Industries of Timor-Leste (Technical Cooperation Project)","2013-06-06","start-actual","","end-actual","German Cooperation","DEU","Timor-Leste","TLS","210","Transport and storage","Implementation","2013","2014","6816113.50963","962908.063144"
"87292191241","1","Urgent Rehabilitation Project for Oecusse Port","2010-09-02","start-actual","2013-02-28","end-actual","Japan International Cooperation Agency","JPN","Timor-Leste","TLS","323","Construction","Completion","2010","2013","12525945.0055","6774682.34483"
"87292643988","1","Innovative approaches to food insecurity in Timor-Leste","2012-08-03","start-actual","2018-07-01","end-actual","European Union","DAC","Timor-Leste","TLS","311","Agriculture","Implementation","2012","2018","1419968.55881","949299.97197"
"87292643975","1","Fourth Rural Development Programme IV (EU funds) Component I","2012-03-08","start-actual","2016-01-31","end-actual","European Union","DAC","Timor-Leste","TLS","311","Agriculture","Implementation","2011","2016","6251172.79","3199762.65907"
"87292646902","0","Global Climate Change Alliance (GCCA) Programme Timor-Leste","2014-01-01","start-actual","","end-actual","European Commission","DAC","Timor-Leste","TLS","311","Agriculture","Implementation","2014","2014","2613480.06","129411.66"
"87292384472","1","UNDP Capacity Building Support to Policia National da Timor Leste (00085256)","2013-01-14","start-actual","","end-actual","United Nations Development Programme|Australian Federal Police|Government Of Japan","AUS|DAC|JPN","Timor-Leste","TLS","150","Government and civil society","Implementation","2013","2014","","1075578.99465"
"87292404405","1","Agriculture and Irrigation Advisor","2013-08-08","start-actual","2015-07-08","end-actual","Japan International Cooperation Agency","JPN","Timor-Leste","TLS","311","Agriculture","Implementation","2013","2015","217458.635481","102338.455481"
"87292191157","1","Timor Leste Police Development Program (TLPDP)","","start-actual","","end-actual","Government Of Australia","AUS","Timor-Leste","TLS","150","Government and civil society","Implementation","2010","2013","78845438.8421","68271975.087"
"87292814702","0","Making the Case for Human Trafficking in Timor-Leste: Informing Program and Policy Development","","start-actual","","end-actual","International Organization for Migration","DAC","Timor-Leste","TLS","150","Government and civil society","Pipeline/identification","2014","2014","200000.0",""
"87292814705","0","Enhanced Migration Management - Technical Assistance for the Government of Timor-Leste on the Border Management System","","start-actual","","end-actual","International Organization for Migration","DAC","Timor-Leste","TLS","150","Government and civil society","Pipeline/identification","2014","2014","1400000.0",""
"87292405777","0","Development of Community Policing Project","2013-04-01","start-actual","","end-actual","Japan International Cooperation Agency","JPN","Timor-Leste","TLS","150","Government and civil society","Implementation","2013","2013","1073160.79155","49127.8922517"
"87292191428","0","Human Resources Cooperation Program","2006-01-01","start-actual","","end-actual","The People's Republic of China","CHN","Timor-Leste","TLS","150","Government and civil society","Implementation","2006","2014","5798511.75705","200000.0"
"87292191252","1","Conflict Mitigation through Community Oriented Policing in Timor-Leste Phase II: Promoting Security through Community-Police Partnerships (CMCOP Phase II: PSCPP)","2009-12-01","start-actual","2014-09-14","end-actual","United States Agency for International Development|New Zealand Aid Programme, Ministry of Foreign Affairs and Trade","USA|NZL","Timor-Leste","TLS","150","Government and civil society","Implementation","2009","2014","4968151.36021","2725239.98099"
"87292481766","1","Timor-Leste Community Policing Programme","2011-07-15","start-actual","2016-07-31","end-actual","New Zealand Aid Programme, Ministry of Foreign Affairs and Trade","NZL","Timor-Leste","TLS","150","Government and civil society","Implementation","2010","2016","11557037.72","2464304.59945"
"87292401936","1","Japan Overseas Cooperation Volunteers (JOCV)","","start-actual","","end-actual","Japan International Cooperation Agency","JPN","Timor-Leste","TLS","700","Humanitarian aid (Including reconstruction and recovery)","Implementation","2010","2013","1018066.16845","337138.678379"
"87292407201","0","The Project of Effective and Accessible Justice System, Social Dialogue and Policing Services for Peacebuilding which contributes to conflict prevention and peace-building in the Democratic Republic of Timor-Leste","2013-12-01","start-actual","2016-02-28","end-actual","Government Of Japan","JPN","Timor-Leste","TLS","150","Government and civil society","Implementation","2013","2016","","15735.0"
"87292191257","1","Youth Radio for Peace Building in Timor-Leste","2010-04-01","start-actual","2015-04-30","end-actual","United States Agency for International Development","USA","Timor-Leste","TLS","920","Support to non-governmental organisations (NGOs) and government organizations","Implementation","2010","2015","2144766.92649","1472606.68383"
"87292434908","0","Apoio a Governacao Democratica em Timor-Leste - componente de apoio a Comunicacao Social","","start-actual","","end-actual","European Union","DAC","Timor-Leste","TLS","220","Communications","Implementation","2011","2013","1303101.38","1282572.80927"
"87292431583","1","Democracy and Development in Action through Media and Empowerment (DAME)","2012-02-01","start-actual","2013-01-31","end-actual","European Union","DAC","Timor-Leste","TLS","150","Government and civil society","Implementation","2012","2013","2055948.10595","1578249.68321"
"87292376065","0","P148264 - Building Capacity for Cadastral Services to Communal Lands Project","","start-actual","","end-actual","World Bank","DAC","Timor-Leste","TLS","311","Agriculture","Pipeline/identification"," "," ","",""
"87292645448","1","Support to peaceful development through innovative employment promotion","2013-09-01","start-actual","","end-actual","German Cooperation","DEU","Timor-Leste","TLS","920","Support to non-governmental organisations (NGOs) and government organizations","Implementation","2012","2014","4885402.24512","813179.759281"
"87292401918","1","The Project for Unity Building through Tree Planting and Conservation of Watershed Areas in Maumeta Village","2011-09-09","start-actual","","end-actual","Japan International Cooperation Agency","JPN","Timor-Leste","TLS","920","Support to non-governmental organisations (NGOs) and government organizations","Implementation","2011","2014","523969.324052","435496.488645"
"87292483953","1","Aquaculture Development","2013-06-26","start-actual","","end-actual","New Zealand Aid Programme, Ministry of Foreign Affairs and Trade","NZL","Timor-Leste","TLS","313","Fishing","Pipeline/identification","2013","2014","","146722.458916"
"87292457126","0","Bolsas de Estudo Internas - Ensino Superior (10397)","2009-01-01","start-actual","","end-actual","Camões - Instituto Da Cooperacao E Da Lingua","POR","Timor-Leste","TLS","110","Education","Implementation","2009","2009","",""
"87292936976","0","Institutional Strengthening for gender Equality and Women's Empowerment in Timor-leste","2013-06-19","start-actual","2018-06-12","end-actual","Norway Ministry of Foreign Affairs","NOR","Timor-Leste","TLS","150","Government and civil society","Implementation","2013","2018","2139217.69393","251310.693927"
"87292817405","0","Disaster Risk Reduction Building Community Resilience in Timor-Leste Phase II - CS.0571","2014-01-01","start-actual","2015-12-31","end-actual","United States Agency for International Development","USA","Timor-Leste","TLS","700","Humanitarian aid (Including reconstruction and recovery)","Implementation","2014","2015","1018137.0","161702.0"
"87292817407","0","Assistance to Irregular Migrants (AIM) in Timor Leste, Phase II-SM.0010","2014-04-01","start-actual","2015-03-31","end-actual","Government Of Australia","AUS","Timor-Leste","TLS","700","Humanitarian aid (Including reconstruction and recovery)","Implementation","2014","2015","39944.99","1136.5"
"87292405693","0","Improvement of Coffee productivity in Ermera and Liquica Districts","2013-09-01","start-actual","2016-08-28","end-actual","Government Of Japan","JPN","Timor-Leste","TLS","311","Agriculture","Implementation","2013","2016","175816.396507","175816.396507"
"87292495983","1","Community Development Project in East Timor","","start-actual","","end-actual","Korean International Cooperation Agency","KOR","Timor-Leste","TLS","998|311|110|160|140","Unallocated/unspecified|Agriculture|Education|Other social infrastructure and services|Water supply and sanitation","Completion","2009","2009","","53568.0460849"
"87292401680","1","The Project for the Construction of Rehabilitation Training Center for the Disabled in Baucau","2011-04-01","start-actual","2012-02-29","end-actual","Government Of Japan","JPN","Timor-Leste","TLS","160","Other social infrastructure and services","Completion","2011","2012","99550.42",""
"87292481497","1","Lafaek Education Support Project","2001-07-01","start-actual","2011-07-30","end-actual","New Zealand Aid Programme, Ministry of Foreign Affairs and Trade","NZL","Timor-Leste","TLS","110","Education","Completion","2001","2011","967430.509142","899782.200961"
"87292452210","0","Escolas de Referência de Timor-Leste - Centros de Formação (10383)","2011-01-01","start-actual","","end-actual","Portugal","PRT","Timor-Leste","TLS","110","Education","Implementation","2011","2013","","3634933.37747"
"872921011801","0","Support to MFI Moris RASIK","2011-01-01","start-actual","2010-12-31","end-actual","Monaco","MCO","Timor-Leste","TLS","240","Banking and financial services","Completion","2010","2011","21756.086749","21756.086749"
"87292891654","1","SO10. Health System Strengthening, Health Policy & Health Service Deliveries","2009-01-01","start-actual","2013-12-31","end-actual","World Health Organization","DAC","Timor-Leste","TLS","120","Health","Implementation","2009","2013","240025.170484","422710.957394"
"87292861566","1","Media & Communication Programme","2009-01-01","start-actual","2013-12-31","end-actual","Government of Netherland|UNICEF Core Resources|United Nations Children's Fund","NLD|DAC","Timor-Leste","TLS","220","Communications","Implementation","2009","2014","887803.857463","1027700.57737"
"87292651793","0","Socialisation Standard Operational Procedure of GBV","2011-09-23","start-actual","2011-12-05","end-actual","Ministry of Social Solidarity","DAC","Timor-Leste","TLS","150","Government and civil society","Completion","2011","2011","4016.15","3995.18"
"87292611848","1","Apoio à Implementação de Sistema de Arquivos de Timor-Leste","2010-07-01","start-actual","","end-actual","Agência Brasileira de Cooperação (Brazil)","BRA","Timor-Leste","TLS","150","Government and civil society","Implementation","2009","2011","715157.211875","362573.676742"
"87292491507","1","Drinking Water Supply by Desalination using Photovoltaic Power Plant(solar panel power)","2010-01-01","start-actual","","end-actual","Korean International Cooperation Agency","KOR","Timor-Leste","TLS","140","Water supply and sanitation","Implementation","2010","2012","6127905.50427","5865664.38069"
"87292391559","1","AusAID Bilateral Support to Education","2012-08-01","start-actual","2013-06-30","end-actual","Australian Aid Program|DFAT - Australian Aid Program","AUS","Timor-Leste","TLS","110","Education","Implementation","2011","2013","3170503.99291","3314192.43115"
"87292191422","1","Institutional Cooperation within power sector","2009-09-02","start-actual","2013-12-31","end-actual","Norway","NOR","Timor-Leste","TLS","230","Energy generation and supply","Implementation","2009","2013","8601053.19046","3059767.5594"
"87292191295","0","Ambassador's Fund for Small Grant Programs","2009-01-01","start-actual","2012-12-31","end-actual","United States Agency for International Development","USA","Timor-Leste","TLS","150","Government and civil society","Completion","2009","2012","303574.819929","299571.852434"
"87292191273","1","TA 7712: Strenghtening Major Public Investment","2011-01-18","start-actual","","end-actual","Ministry of Finance|Asian Development Bank","DAC","Timor-Leste","TLS","150","Government and civil society","Implementation","2010","2012","280862.335612","85416.2124802"
"87292191220","1","G0180: Road Network Development Sector Project","2010-04-05","start-actual","","end-actual","Ministry of Public Works|Asian Development Bank","DAC","Timor-Leste","TLS","210","Transport and storage","Implementation","2010","2014","54027700.1959","30166773.3998"
"87292191124","1","Australian Development Awards East Timor","2010-01-01","start-actual","2017-06-30","end-actual","Australian Aid Program|DFAT - Australian Aid Program","AUS","Timor-Leste","TLS","110","Education","Implementation","2006","2017","25716829.4705","8696750.14792"
"872921051818","0","Human Rights Programme 2010","2010-01-01","start-actual","2010-12-31","end-actual","Office of the United Nations High Commissioner for Human Rights","DAC","Timor-Leste","TLS","400","Multisector/cross-cutting","Completion","2010","2010","149680.219847","144467.414898"
"872921051817","0","Support to NGOs 2010","2010-01-01","start-actual","2010-12-31","end-actual","Office of the United Nations High Commissioner for Human Rights","DAC","Timor-Leste","TLS","920","Support to non-governmental organisations (NGOs) and government organizations","Completion","2010","2010","11847.2839749","11847.2839749"
"872921051816","0","Support to Government and Civil Society 2010","2010-01-01","start-actual","2010-12-31","end-actual","Office of the United Nations High Commissioner for Human Rights","DAC","Timor-Leste","TLS","150","Government and civil society","Completion","2010","2010","35899.3130792","34846.33465"
"872921051815","0","Human Rights Education 2010","2010-01-01","start-actual","2010-12-31","end-actual","Office of the United Nations High Commissioner for Human Rights","DAC","Timor-Leste","TLS","110","Education","Completion","2010","2010","25532.9396011","25532.9396011"
"872921051814","0","Human Rights Programme 2011","2011-01-01","start-actual","2011-12-31","end-actual","Office of the United Nations High Commissioner for Human Rights","DAC","Timor-Leste","TLS","400","Multisector/cross-cutting","Completion","2011","2011","340786.0","157084.0"
"872921051813","0","Support to NGOs 2011","2011-01-01","start-actual","2012-12-31","end-actual","Office of the United Nations High Commissioner for Human Rights","DAC","Timor-Leste","TLS","920","Support to non-governmental organisations (NGOs) and government organizations","Completion","2011","2012","36000.0","36000.0"
"872921051812","0","Support to Government and Civil Society 2011","2011-01-01","start-actual","2011-12-31","end-actual","Office of the United Nations High Commissioner for Human Rights","DAC","Timor-Leste","TLS","150","Government and civil society","Completion","2011","2011","21000.0","19303.0"
"872921051811","0","Human Rights Education 2011","2011-01-01","start-actual","","end-actual","Office of the United Nations High Commissioner for Human Rights","DAC","Timor-Leste","TLS","110","Education","Completion","2011","2011","9000.0","5877.0"
"872921051810","0","Human Rights Programme 2012","2012-01-01","start-actual","","end-actual","Office of the United Nations High Commissioner for Human Rights","DAC","Timor-Leste","TLS","400","Multisector/cross-cutting","Completion","2012","2012","118198.273972","1963.68743308"
"872921051809","0","Support to NGOs 2012","2012-01-01","start-actual","","end-actual","Office of the United Nations High Commissioner for Human Rights","DAC","Timor-Leste","TLS","920","Support to non-governmental organisations (NGOs) and government organizations","Completion","2012","2012","47324.8671372","54197.7731529"
"872921051808","0","Support to Government and Civil Society 2012","2012-01-01","start-actual","","end-actual","Office of the United Nations High Commissioner for Human Rights","DAC","Timor-Leste","TLS","150","Government and civil society","Completion","2012","2012","28473.4677796","3927.37486615"
"872921051807","0","Human Rights Education 2012","2012-01-01","start-actual","","end-actual","Office of the United Nations High Commissioner for Human Rights","DAC","Timor-Leste","TLS","110","Education","Completion","2012","2012","11782.1245985","12763.968315"
"872921011827","1","Business Registration and Licensing Reform","2010-07-01","start-actual","","end-actual","International Finance Corporation","DAC","Timor-Leste","TLS","250","Business and other services","Implementation","2010","2011","986770.495446","527296.173982"
"87292406967","0","Adviser for Water Supply Improvement","","start-actual","","end-actual","Japan International Cooperation Agency","JPN","Timor-Leste","TLS","140","Water supply and sanitation","Implementation","2014","2014","","85861.48"
"87292406966","0","Enhancing Community Health Workers'(CHW) Activities through SISCA in Hatolia- Sub District","","start-actual","","end-actual","Japan International Cooperation Agency","JPN","Timor-Leste","TLS","120","Health","Implementation","2014","2014","510201.58","77043.06"
"87292457128","0","Programa de Apoio à Aliança Global para as Alterações Climáticas em Timor-Leste (10541)","2014-01-01","start-actual","","end-actual","European Union","DAC","Timor-Leste","TLS","400","Multisector/cross-cutting","Implementation","2014","2014","",""
"87292457141","0","Envelope Financeiro - Setor Educação (10435)","2015-02-28","start-actual","","end-actual","Camões - Instituto Da Cooperacao E Da Lingua","POR","Timor-Leste","TLS","110","Education","Pipeline/identification","2015","2015","",""
"87292457150","0","Cooperação na área do desporto - Projeto Global (10458)","2013-01-01","start-actual","2013-12-31","end-actual","Portugal","PRT","Timor-Leste","TLS","160","Other social infrastructure and services","Implementation","2013","2013","",""
"87292377373","0","P149600/TF016695: Infrastructure Development and PPP","2014-03-20","start-actual","","end-actual","Australian Aid Program|DFAT - Australian Aid Program","AUS","Timor-Leste","TLS","321","Industry","Implementation","2014","2014","250000.0","8260.0"
"87292376055","0","P132567/TF014730 Timor-Leste Land and Resource Governance - Technical Assistance","2013-04-30","start-actual","2015-04-30","end-actual","World Bank","DAC","Timor-Leste","TLS","150","Government and civil society","Implementation","2012","2015","289215.87544","286646.142448"
"87292377339","0","P148808: Programa Nasional Dezenvolvimentu Suku (PNDS) Research and Evaluation Program","2014-04-07","start-actual","","end-actual","Australian Aid Program|DFAT - Australian Aid Program","AUS","Timor-Leste","TLS","160","Other social infrastructure and services","Implementation","2014","2014","","591496.0"
"87292377358","0","P146118/TF091651: Human Resources for Health","2013-09-05","start-actual","","end-actual","Australian Aid Program|World Bank|European Union|DFAT - Australian Aid Program","AUS|DAC","Timor-Leste","TLS","120","Health","Implementation","2013","2014","","61667.5139408"
"87292377360","0","P146119/TF091651: Institutional Reform of SAMES","2013-05-24","start-actual","","end-actual","Australian Aid Program|World Bank|European Union|DFAT - Australian Aid Program","AUS|DAC","Timor-Leste","TLS","120","Health","Implementation","2013","2014","","38245.7830759"
"87292377365","0","P145528/TF091651: Timor-Leste Health Programmatic AAA","2013-04-03","start-actual","","end-actual","Australian Aid Program|World Bank|European Union|DFAT - Australian Aid Program","AUS|DAC","Timor-Leste","TLS","120","Health","Implementation","2013","2015","270499.0","220847.087942"
"87292377370","0","P145866: Technical Assistance for Telecoms Regulation","","start-actual","","end-actual","World Bank","DAC","Timor-Leste","TLS","321","Industry","Implementation","2013","2014","34869.1054396","29528.0"
"87292377376","0","P151167/TF016976: Strengthening Country Systems for Service Delivery","2014-06-03","start-actual","","end-actual","Australian Aid Program|DFAT - Australian Aid Program","AUS","Timor-Leste","TLS","150","Government and civil society","Implementation","2014","2014","350000.0",""
"87292377383","0","P147838/TF: Education Sector Policy Advisory Support","","start-actual","","end-actual","Australian Aid Program|DFAT - Australian Aid Program","AUS","Timor-Leste","TLS","110","Education","Pipeline/identification"," "," ","",""
"87292377393","0","P150886/TF016695: Telecommunications Technical Assistance Program","","start-actual","","end-actual","Australian Aid Program|DFAT - Australian Aid Program","AUS","Timor-Leste","TLS","220","Communications","Pipeline/identification"," "," ","",""
"87292496985","0","Provision of textbooks and teacher training for science education towards green growth and a sustainable future","","start-actual","","end-actual","United Nations Educational, Scientific and Cultural Organization","DAC","Timor-Leste","TLS","110","Education","Implementation","2014","2014","","608757.2"
"87292496940","0","The 2nd Project for capacity building of the ministry of education printing center","","start-actual","","end-actual","Korean International Cooperation Agency","KOR","Timor-Leste","TLS","110","Education","Implementation","2013","2014","","210420.178228"
"87292391903","1","The Asia Foundation Timor-Leste Partnership(TAF)","2012-02-08","start-actual","2013-06-30","end-actual","Australian Aid Program|DFAT - Australian Aid Program","AUS","Timor-Leste","TLS","920","Support to non-governmental organisations (NGOs) and government organizations","Implementation","2012","2013","1227797.95341","2325513.00894"
"87292401927","1","The Project for rehabilitation and Improvement of Maliana ⅠIrrigation System Follow Up","2013-04-07","start-actual","","end-actual","Japan International Cooperation Agency","JPN","Timor-Leste","TLS","311","Agriculture","Implementation","2013","2014","821809.158409","479956.088229"
"87292191227","1","The Project for Community-based Sustainable Natural Resource Management","2010-08-01","start-actual","","end-actual","Japan International Cooperation Agency","JPN","Timor-Leste","TLS","312","Forestry","Implementation","2010","2014","2880108.07466","2056800.09347"
"87292407183","0","Project for Promoting Agribusiness by Rural Women","2013-10-01","start-actual","","end-actual","Japan International Cooperation Agency","JPN","Timor-Leste","TLS","311","Agriculture","Implementation","2013","2014","218492.775616","126087.3345"
"87292817419","0","Disaster Risk Reduction Building Community Resilience in Timor-Leste Phase (Cost Modification)","2015-07-01","start-actual","2016-12-31","end-actual","Office of Foreign Disaster Assistance","USA","Timor-Leste","TLS","400","Multisector/cross-cutting","Pipeline/identification","2015","2016","",""
"87292817415","0","Strengthening Labour Migration Management in Timor-Leste - LM.0253","2014-07-21","start-actual","2016-01-20","end-actual","International Organization for Migration Development Fund","DAC","Timor-Leste","TLS","998","Unallocated/unspecified","Implementation","2014","2016","200000.0",""
"87292817412","0","Strengthening Labour Migration Management in Timor Leste-LM.0253","","start-actual","","end-actual","Unspecified","DAC","Timor-Leste","TLS","110","Education","Implementation"," "," ","",""
"87292993450","1","Assistance to Irregular Migrants - SM.0007","2012-09-01","start-actual","2013-08-31","end-actual","International Organization for Migration","DAC","Timor-Leste","TLS","160","Other social infrastructure and services","Implementation","2012","2014","107652.074607","19334.1804129"
"872921015403","0","Timor-Leste Maize Storage Project (""TLMSP"")","2012-10-01","start-actual","","end-actual","International Fund for Agricultural Development","DAC","Timor-Leste","TLS","500","Commodity aid and general programme assistance","Implementation","2012","2013","4903327.52039","1407831.09728"
"87292191133","1","P104794/IDA-H343, TF091653: Health Sector Strategic Plan Support Project","2008-03-25","start-actual","2015-06-15","end-actual","Australian Aid Program|World Bank|European Union|DFAT - Australian Aid Program","AUS|DAC","Timor-Leste","TLS","120","Health","Implementation","2008","2015","36307091.5081","21570932.9129"
"87292377397","0","P150407/TF016976: Trade and competitiveness for Oecusse","","start-actual","","end-actual","Australian Aid Program|DFAT - Australian Aid Program","AUS","Timor-Leste","TLS","331","Trade policy and regulations","Implementation","2014","2014","","13418.0"
